name,address,characteristics,time,transport,tags,reference
中華そば 寶來軒,704台南市北區公園南路206號,原台北西湖市場的人氣店：豚骨家，之後搬遷到台南。而豚骨家的招牌已結束變成寶來軒，豚骨家原址已變成圓寶。豚骨家的豚骨拉麵是台灣拉麵歷史上很重要的一個指標，很多當今的人氣店都有受到豚骨家和金子先生的啟發！從寶來軒後的品項開始走向更多元，以招牌的豚骨湯為基礎的衍伸。,11:30~14:00、17:30~20:00(有不定休的可能，以粉專公告為主),兵工廠,#ramentw #台灣拉麵愛好會 #拉麵 #豚骨 #2019名店,Huang Wei - 德島拉麵   https://bit.ly/2XZ2cNh   Ben Wo - 超濃厚MEGA豚   https://bit.ly/35trwx3   李孟庭-超濃厚MEGA豚拉麵   http://bit.ly/2rC8DIU   
菜良sara-日式拉麺,701台南市東區崇明路44號,台灣少數主打二郎系的拉麵店，老闆在神奈川県茅ヶ崎市的二郎系名店:菜良sara修業後回台南開業。是台灣二郎系拉麵中的旁系和南部二郎代表，味道上和正統二郎相較下還多份細緻和協調。麵友推薦點多份叉燒變成厚切，還有咖哩粉+拌麵也是絕配！另外也可以嘗試念二郎咒語：「野菜、背脂、大蒜、醬底，都可以免費做客製化增量！」,11:30-14:00、17:30-21:00週一 公休(粉專每個月會公告當月休假日，以粉專為主),臺南監理站,#ramentw #台灣拉麵愛好會 #拉麵 #沾麵 #拌麵 #二郎 #限定 #2019名店,Jasmine Chang - 南高梅拉麵   https://bit.ly/36JSNfO   林家和 - 烏帽子拉麵   https://bit.ly/3eJdVWL   李孟庭 - 烏帽子拉麵   https://bit.ly/2xs4rOk   
麵屋青鈴（麺や青鈴）,71081台南市永康區新行街33巷1號,開業於2019年11月，以豚湯系為主體，近來不定時會開發新品項，以饗麵友們的味蕾，詳情可察看下方網友食記。,11:30~13:30、17:00~20:00週四 公休,台南應用科大,#ramentw #台灣拉麵愛好會 #拉麵 #豚骨 #擔擔麵,Huang Wei - 限定。濃厚虱目魚白湯   https://bit.ly/35Apzkr   鄭傑瑞 - 鰹節醬油拉麵、醬油豚骨拉麵 https://bit.ly/2EpSUmr   Huang Wei - 柔蒜豚骨   https://bit.ly/304GO9c   
豚骨家—小北店,70450台南市北區育德路160號,原址為西湖市場豚骨家，之後金子先生開設圓寶及寶來軒之後，再次於台南復刻豚骨家的好味道，本店湯頭以雞豚湯為主軸，開幕於2018年11月。,11:30-14:00、17:30-20:00,小北自助餐,#ramentw #台灣拉麵愛好會 #拉麵 #油拌麵 #雞豚 #煮干 #2019名店,Stars Yang - 青葉系中華Soba   http://bit.ly/39O903t   Ken Chin - 雞白湯＼雞綠湯＼中華力Soba＼東京油麵＼函館鹽拉麵＼Mega＼熊本拉麵   http://bit.ly/2Qcg41b   Cheng-Chieh Huang - 函館鹽味拉麵   http://bit.ly/2weO8Rv   
五黑家日式拉麵,704台南市北區公園北路104號消防局隔壁,"台南少數雞湯為主打的店家，雞湯呈現還有分成基本的醬油、焦香、邪道。比較特別的就是邪道，裡面是加入生雞蛋來增加湯的濃厚度。配料也出現拉麵少見的雞肉丸子，另外可以加點鍋巴來入湯也是這間有趣的方式。另外就是店家會根據季節來出不同的限定，然後食量大無肉不歡的麵友也可以嘗試""樹根""叉燒。此外店主對於自己的要求非常高，所以不能出的湯頭就會休息。要出發前記得先確認粉專消息，另外五黑家也提供預訂。",星期一、二 休息星期三-五 17:00-22:00星期六、日 11:00-15:00、17:00-22:00*提早賣完會提早結束,台南市／公園北路,#ramentw #台灣拉麵愛好會 #拉麵 #雞湯 #2019名店,李孟庭 - 焦香醬油拉麵半碗   https://bit.ly/2WFQXcA   李孟庭 - 味噌雞湯   https://bit.ly/3dpeuUY   李孟庭-原味雞湯拉麵   http://bit.ly/2SBxM1v   
山越拉麵 - 總店,600嘉義市東區中正路349號,嘉義當地知名的排隊拉麵店，以豚湯為主體，湯頭和麵條軟硬度可以客製化。2017年5月開始與鬼金棒技術合作模式轉型，定期出限定款拉麵也讓嘉義拉麵與台北口味同步！,週一~五 17:00~21:00(豚骨)週六~日 11:30~14:00(雞湯)、17:00-21:00(豚骨)「每日湯頭售完提早打烊」週二 公休,林聰明砂鍋魚頭,#ramentw #台灣拉麵愛好會 #拉麵 #豚骨 #限定 #變化,吳清宏 - 醬油豚骨拉麵   https://bit.ly/2JlmwDQ   吳清宏 - 八幡屋七味麻婆豆腐雞白湯拉麵   https://bit.ly/2UIQ0Om   吳清宏 - 八幡屋七味麻婆豆腐豚骨拉麵   https://bit.ly/2IGwOOX   
覺丸拉麵,701台南市東區東興路275號,台南人氣拉麵店之一，此間店採登記制度因此到店記得先找女老闆登記呦~此外也請留意店家的用餐注意事項。覺丸主打豚骨湯頭，也可以客製化做調整。詳細內容可以參閱下方麵友的食記~,週一 11:30-14:00、17:00-20:00週二 休息週三-日 11:30-14:00、17:00-20:00,台南市東區／東興路,#ramentw #台灣拉麵愛好會 #拉麵 #豚骨,Stars Yang - 豚骨叉燒拉麵   http://bit.ly/2weIGgY   Chen Jelly - 豚骨叉燒拉麵   http://bit.ly/2L75mVT   
淳鳩一夫拉麵,700台南市中西區民權路二段218號,雞魚雙湯頭為主打，是源自一心一勝體系。但是老闆自己也不斷的精進和研發新的菜色和配料提供給麵友們！是台南雞白湯店的好選擇，店家的溏心蛋一直廣受麵友好評，喜歡吃蛋的麵友也可以多加點來試試~叉燒目前除了原本的豬夾肉外也多了梅花叉燒肉，近期還有低溫叉燒的選擇。來滿足麵友們！,11:30-售完、17:00-售完週日 店休,武廟,#ramentw #台灣拉麵愛好會 #雞白湯 #雞魚,Franco Sofa Lee - 干貝雞湯拉麵 https://bit.ly/2HA8a25   Huang Wei - 雞鴨雙湯   https://bit.ly/2YFfiPK   Stars Yang - 蒜味雞白湯拉麵   http://bit.ly/2Ks9JKN   
俺の豚,710台南市永康區東橋一路250號,開業於2017年7月22日，是豚骨拉麵專賣店，溏心蛋會有玉字為特色之一。,11:30~14:00，17:30~20:30週一 休息,東橋一路,#ramentw #台灣拉麵愛好會 #拉麵 #豚骨,Huang Wei - DSP濃厚豚骨拉麵、濃厚豬雞魚介沾麵   https://bit.ly/3pZATyv   Huang Wei - DSP濃厚豚骨拉麵   https://bit.ly/2Yyi1Lj   吳俊青 - SP濃厚豚骨拉麵   https://bit.ly/2rpOEcT      
八峰亭,700台南市中西區萬昌街15號,台南人氣拉麵店之一，店家最特別的是特殊的預約制度。需要提前去預約用餐時間，此外還需要押金100如果沒去不會退還。外縣市的麵友建議可以早點去等待詢問是否可以補上，或是請當地朋友幫忙先預約。叉燒的有限量厚切的部分，如果喜好厚實的叉燒不要錯過了。此外近期有販售快煮包，如果不方便出門吃拉麵也可以買回家煮呦！,週一~二 10:30~13:00週三 公休週四~日 10:30~13:00,台南市／萬昌街,#ramentw #台灣拉麵愛好會 #拉麵 #豚骨,Athena Wu - 豚骨拉麵   https://bit.ly/32laoc0   Stars Yang - 豚骨魚介青蔥拉麵   http://bit.ly/2ORpIoq   吳俊青 - 乾麵套餐   http://bit.ly/2MntcSO   
麵屋木心 ラーメン専門店(十一月未定),600嘉義市西區延平街275號,預計於11月左右復業，並遷移至新址。開業於2019年7月，是台灣少數以煮干系為主打湯頭的店家，詳情可察看下方網友食記。,17:00~24:00週一、四、日 公休,待確認,#ramentw #台灣拉麵愛好會 #拉麵 #煮干,吳清宏 - 淡麗醬油+魚介沾麵   https://bit.ly/30IATsh   Stars Yang - 雞塩拉麵   https://bit.ly/2VXsnTn   Stars Yang - 醬油煮干   https://bit.ly/2xFbvat   
一拉面,704台南市北區長榮路五段35號,開業於2018年01月24日，好喝又順口的豚骨湯，不單只有食材的精選及挑選，最為重要是火侯的控制及用心。,"11:30-14:00, 17:30-21:00週三 休息",開元振興公園，5路公車，富台新村下車,#ramentw #台灣拉麵愛好會 #拉麵 #豚骨,徐尚聿 - 豚骨雞白湯拉麵   https://bit.ly/3k9A0jT   林子祥 - 豚骨拉麵   http://bit.ly/2Pw2xjf   龍司 - 赤辛豚骨拉麵   http://bit.ly/2B7pynq   
Nani麵,700台南市中西區新美街163號,"台南少有的主打""沾麵""的拉麵店，味道是豚骨魚介的口味。沾麵可以選擇的肉品項有：牛、雞、豬可以選擇，豬肉則是五花肉是比較特別的地方。整體風格呈現類似台北麵屋緣。","11:00-14:30, 16:30-19:10",赤崁樓，3或5路公車,#ramentw #台灣拉麵愛好會 #沾麵 #豚骨 #豚骨魚介 #咖哩,吳清宏 - 豚骨魚介赤辛沾麵豬+秘制花雕沾麵牛   https://bit.ly/34cJYeZ   Athena Wu - 秘製花雕沾麵-豚   https://bit.ly/2XJZSZx   吳俊青 - 招牌豚骨魚介沾麵   https://bit.ly/2B4dlQf   
虎川亭(2021年預計),632雲林縣虎尾鎮民生路8-4號,目前老闆養病中，預計2021年重開。粉專建立於2018年9月，開業約於2019年5月，是以雞湯系為主體，偏向淡麗味覺，並有藍色雞湯拉麵為主的各式創新拉麵，是雲林在地難得一見的創意料理店家，詳情可察看下方網友食記。,11:00~14:00、17:00~20:00,美芝城,#ramentw #台灣拉麵愛好會 #拉麵 #雞骨 #限定,Stars Yang - 辛口醬油拉麵+西班牙生火腿拉麵   https://bit.ly/2Z3ZAz0   Abby Liu - 戰斧雞腿拉麵   https://bit.ly/2vVH3bI   Stars Yang - 西班牙生火腿拉麵+芳醇醬油拉麵   http://bit.ly/3a2I0Oc   
麵家宇味,700台南市中西區民族路三段62號,開業於2012年7月23日，原本叫宇味拉麵，是一家日式拉麵店，2014年5月整修後改麵家宇味，詳情參閱下方麵有食記。,"週四-週二 11:30-14:30, 17:30-21:00週三 休息(不定期)","永樂市場，77, 藍23, 藍24公車，在永樂市場下車",#ramentw #台灣拉麵愛好會,蔡佩岑 - 番茄起司拉麵   https://bit.ly/2E9mIkR   Shih-Yao Frank Lin - 濃厚叉燒豚骨拉麵   https://bit.ly/2BXjvDJ   
麵屋柴 雞白湯拉麵專賣店,632雲林縣虎尾鎮仁愛路61號,開業於2018年10月26日，是一群愛柴犬也愛拉麵的年輕人開的拉麵店，湯頭是手工熬湯，以用全雞、蔬菜熬製。,"星期五-三 11:30–14:00, 17:30–21:00星期四 休息",雲林布袋戲館，台西客運虎尾站(9015路),#ramentw #台灣拉麵愛好會,李俊 - 奶油蛤蜊雞白湯拉麵   https://bit.ly/2rt1UgU   洪國軒 - 奶油蛤蜊雞白湯   http://bit.ly/2WLT63K   
北極星拉麵HOKKYOKUSEI,708台南市安平區建平路254號,開幕於2020年2月15日，主軸為豚骨與雞湯，詳情可察看下方網友食記。,11:30~14:00、17:30~21:00,建平七街、建平路,#ramentw #台灣拉麵愛好會 #拉麵 #豚骨 #雞清,由你來寫第一篇   
山形心心拉麵-嘉義新光店,600嘉義市西區垂楊路726號,此店位於新光三越。將製麵者的心跟客人的心連繫在一起，為紀念此願景日本山形總店取名為心心，在台灣也希望能用此日本傳統精神將日本跟台灣人的心彼此更加靠近，故與日本總店取同名。,11:00 - 22:00,新光三越嘉義垂楊店,#ramentw #台灣拉麵愛好會 #拉麵 #沾麵 #二郎風,楊德輝 - 辛味噌拉麵   https://bit.ly/2MOnHdw   林小逼 - 魚豚野郎(中)   https://bit.ly/2MrYVBz   Candy Yang - 魚豚野郎(大)   https://bit.ly/2Ma1FE2   Nora Neko -定豚野郎拉麵   https://bit.ly/2vE1HtL   
圓拉麵,640雲林縣斗六市九如街4號,開業於2016年4月1日，主打雞魚雙湯頭，是一心一勝的徒弟店。雞湯圓潤滑順，色澤金黃，口感醇厚，屬白湯類型；魚湯鮮麗美妙，色澤灰白，口感甘甜，屬濁湯類型。此外店主也有開發特色新品，像花雕雞就是好評的限定之一。,11:30-13:30，17:00-20:00週三 休息,雲林溪美食廣場旁邊,#ramentw #台灣拉麵愛好會 #拉麵 #雞白 #魚介雞湯 #限定,Stars Yang - 醬油雞湯拉麵   http://bit.ly/2QoumPH   吳俊青 - 雞湯拉麵+魚湯拉麵   http://bit.ly/2rvPgO7   Clover Yuan - 蒜香濃厚雞白湯拉麵+辛魚湯拉麵   http://bit.ly/2L9zbql   
小卷拉麵屋,640雲林縣斗六市民生路48-1號,是當地特色及平價的拉麵店，詳情參閱下方麵友食記。,11:00~14:00、17:00~20:00週六 休息,小北百貨斗六店,#ramentw #台灣拉麵愛好會 #拉麵,Weight Wang - 背脂豚骨拉麵   https://bit.ly/2UsCEo0   
富士達人日本拉麵-東寧總店,701台南市東區東寧路504號,粉專建立於2011年1月，主軸為豚骨，詳情可察看下方網友食記。,週一~五 11:00~14:30、17:00~21:30週六~日 11:00–22:00,東光路、東寧路,#ramentw #台灣拉麵愛好會 #拉麵 #豚骨,由你來寫第一篇   
中華そば太郎拉麵,700台南市中西區新美街2號,為當地少數素食拉麵店之一，店內裝潢走80年代復古日本風。,週一-五 18:30-21:00週六-日 12:30-14:30、18:30-21:30,郭綜合醫院，5，7，14，18，藍24路公車，西門民權路口站下車,#ramentw #台灣拉麵愛好會 #拉麵 #素食,柯學良-柚子椒鹽拉麵   https://bit.ly/3kYN4sV   
Mr. 拉麵 絆(台南勝利店),701台南市東區勝利路54-1號,始於2012年10月在台北公館，老闆曾當過記者和東京都議員，在台北念博士班期間開平價拉麵店，很受學生客群歡迎，2013年進軍台南開設勝利分店，成功打開台南市場而快速展店，2017年6月28日改名為Mr拉麺の野崎家，原Mr拉麺成姊妹店。,11:15-14:30、17:00-21:00,台南一中，成功大學；6路公車，台南一中站下車,#ramentw #台灣拉麵愛好會 #拉麵,無   
東京豚骨拉麵の野崎家(崇德店),701台南市東區崇德路567號,始於2012年10月在台北公館，老闆曾當過記者和東京都議員，在台北念博士班期間開平價拉麵店，很受學生客群歡迎，2013年進軍台南開設勝利分店，成功打開台南市場而快速展店，而後改名為Mr拉麺の野崎家，原Mr.拉麵成姊妹店，本店開業於2015年10月7日。,"週一-五11:15-14:30, 17:00-20:45週六-日11:30-15:00, 17:00-21:00",華生動物醫院；3路公車，崇德十街口站下車,#ramentw #台灣拉麵愛好會,Tsai Sunta - 博多豚骨醬油拉麵／博多豚骨味僧拉麵   https://bit.ly/2EbX6UO   
Mr. 拉麵 絆(台南海佃店),709台南市安南區海佃路一段158巷7號,始於2012年10月在台北公館，老闆曾當過記者和東京都議員，在台北念博士班期間開平價拉麵店，很受學生客群歡迎，2013年進軍台南開設勝利分店，成功打開台南市場而快速展店，本店除拉麵之外，還有丼飯和烏龍麵。,11:30-14:30、17:00-20:45,丹丹漢堡安南店；3，10，藍23，藍24公車，協成社區站下車,#ramentw #台灣拉麵愛好會 #拉麵,無   
Mr. 麵王(永康店),710台南市永康區中華二路258號,開業於2014年7月1日，原本是Mr拉麵分店之一，而後發展為為Mr.麵王之品牌。,週一-五 11:20-14:30、17:00-20:45週六-日 11:00-15:00、17:00-21:00,家樂福中華店,#ramentw #台灣拉麵愛好會 #拉麵,無   
Mr.RAMEN 豚骨拉麵店,600嘉義市西區仁愛路229號,始於2012年10月始於台北公館開店，老闆曾當過記者和東京都議員，在台北念博士班期間開平價拉麵店，很受學生客群歡迎，本店開業於2018年6月底。,11:30-14:30、17:00-20:45,嘉義遠東百貨公司,#ramentw #台灣拉麵愛好會,無   
Mr. 拉麵 雲,640雲林縣斗六市中堅西路743號,始於2012年10月在台北公館，老闆曾當過記者和東京都議員，在台北念博士班期間開平價拉麵店，很受學生客群歡迎，2013年進軍台南開設勝利分店，成功打開台南市場而快速展店，本店開業於2017年8月15日，為Mr.拉麵姊妹店。,週一-五 11:00~14:30，17:00~21:00週六-日 11:00~15:00，17:00~21:00,家樂福 斗六店,無提供標籤資訊,無
大麦小麦日式酒食,60045嘉義市東區融和街57號,開業於2019年5月，是一間不定期推出拉麵限定的居酒屋，深受在地民眾喜愛，詳情可察看下方網友食記。,11:30~14:00、17:00~21:00,Felicita幸福無限創意可頌專賣店,#ramentw #台灣拉麵愛好會 #拉麵 #限定,Stars Yang - 柚香鹽味   http://bit.ly/39XAN1z   何浩然 - 醣心蛋雞白湯拉麵   http://bit.ly/2m088W5   
京正拉麵-興華店,700台南市中西區興華街25號,開業於2012年8月10日，隱藏在巷弄中的拉麵店，別於一般拉麵店，我們走的是較為現代極簡風格，希望帶給你更特別的感受！自家熬製大骨高湯，天然食材保證！,週一~五 11:30~21:30週六~日 11:00~22:00,台南啟聰學校，3、紅幹線公車，縣知事官邸站下車,#ramentw #台灣拉麵愛好會,Chih-Hung Weng - 味噌豚骨拉麵   https://bit.ly/2G9pt8x   Wen Hsiang Wang - 濃厚拉麵   https://bit.ly/2GaH5kn   
京正拉麵-育樂店,701台南市東區育樂街109號,開業於2015年1月1日，我們走的是較為現代極簡風格，希望帶給你更特別的感受！自家熬製大骨高湯，天然食材保證！,週一~五 11:30~21:30週六~日 11:00~22:00,遠東百貨公司台南成功店，台南後火車站,#ramentw #台灣拉麵愛好會,無   
獅神拉麵,708台南市安平區湖內一街26號,開業於2018年11月，以豚骨、雞湯做為主軸，詳情可察看下方網友食記。,17:30–22:00週一、四 公休,湖內一街,#ramentw #台灣拉麵愛好會 #拉麵 #豚骨 #雞湯,由你來寫第一篇   
元町家 橫濱家系拉麵,600嘉義市東區忠孝路600號,開業於2019年11月，位於耐斯廣場B1F，是嘉義當地的橫濱家系拉麵，詳情可察看下方網友食記。,11:00~21:30,耐斯廣場,#ramentw #台灣拉麵愛好會 #拉麵 #家系,王邦任 - 醬油拉麵   http://bit.ly/2SM1u3u   
山崎拉麵,600嘉義市西區國華街248號,開業於2012年10月27日，前日商社長山崎龍二原本是開可樂餅，後來2014年12月11日擴大成山崎お食事処，是日本原汁原味的拉麵店，另外有賣烏龍麵和關東煮。,週一、週三-週五 16:30-21:00週六-週日 12:00-21:00週二 休息,中正公園，陳澄波紀念館,#ramentw #台灣拉麵愛好會 #拉麵,Weight Wang - 味噌拉麵   https://bit.ly/2RILZ9J   容君緋 - 香蔥辛味噌拉麵+味噌拉麵+黑豚骨拉麵   https://bit.ly/2E6aauO   
赤野拉麵,600嘉義市西區國華街137號,開業於2016年1月4日，主打豚骨湯頭，屬平實價位，詳情參閱下方麵友食記。,週一-週日 11:00-14:00、17:00-21:00,嘉義市朝天宫或文化公園,#ramentw #台灣拉麵愛好會 #拉麵 #豚骨,Stars Yang - 豚骨大蒜拉麵   https://bit.ly/2RJ5i2z   李偉煥 - 豚骨拉麵   https://bit.ly/2QCIa8I   
一榮拉麵,700台南市中西區郡緯街1號,開業於2019年6月，以豚骨湯為主的拉麵店，詳情可察看下方網友食記。,11:00–14:00、17:00–21:00,郡緯街／Nani麵,#ramentw #台灣拉麵愛好會,吳俊青 - 一榮拉麵   http://bit.ly/32ObvQV   王智昊 - 一榮拉麵   http://bit.ly/2Zmk9Ug   
金屋拉麵,701台南市東區府連東路3號,開業於2019年5月，以豚骨湯為主的淡麗系台式拉麵，該店的主要客群是針對愛好CP值的客人，詳情可察看下方網友食記。,1100-1400、1700-2100週一 店休,冒煙的喬,#ramentw #台灣拉麵愛好會 #拉麵,雲劍 - 豚骨拉麵   http://bit.ly/2GFsbR1   
